{
  "$id": "https://sdlc.local/schemas/claude-security-delivery.schema.json",
  "$schema": "https://json-schema.org/draft/2020-12/schema",
  "type": "object",
  "properties": {
    "schema": {
      "type": "number",
      "const": 1
    },
    "source": {
      "type": "string",
      "const": "claude-security"
    },
    "deliveryId": {
      "type": "string",
      "minLength": 1
    },
    "run": {
      "type": "object",
      "properties": {
        "id": {
          "type": "string",
          "minLength": 1
        },
        "url": {
          "type": "string",
          "format": "uri"
        },
        "startedAt": {
          "type": "string",
          "format": "date-time",
          "pattern": "^(?:(?:\\d\\d[2468][048]|\\d\\d[13579][26]|\\d\\d0[48]|[02468][048]00|[13579][26]00)-02-29|\\d{4}-(?:(?:0[13578]|1[02])-(?:0[1-9]|[12]\\d|3[01])|(?:0[469]|11)-(?:0[1-9]|[12]\\d|30)|(?:02)-(?:0[1-9]|1\\d|2[0-8])))T(?:(?:[01]\\d|2[0-3]):[0-5]\\d:[0-5]\\d(?:\\.\\d+)?(?:Z|([+-](?:[01]\\d|2[0-3]):[0-5]\\d)))$"
        },
        "finishedAt": {
          "type": "string",
          "format": "date-time",
          "pattern": "^(?:(?:\\d\\d[2468][048]|\\d\\d[13579][26]|\\d\\d0[48]|[02468][048]00|[13579][26]00)-02-29|\\d{4}-(?:(?:0[13578]|1[02])-(?:0[1-9]|[12]\\d|3[01])|(?:0[469]|11)-(?:0[1-9]|[12]\\d|30)|(?:02)-(?:0[1-9]|1\\d|2[0-8])))T(?:(?:[01]\\d|2[0-3]):[0-5]\\d:[0-5]\\d(?:\\.\\d+)?(?:Z|([+-](?:[01]\\d|2[0-3]):[0-5]\\d)))$"
        }
      },
      "required": [
        "id"
      ],
      "additionalProperties": false
    },
    "repo": {
      "type": "object",
      "properties": {
        "name": {
          "type": "string",
          "minLength": 1
        },
        "commit": {
          "type": "string"
        }
      },
      "required": [
        "name"
      ],
      "additionalProperties": false
    },
    "findings": {
      "type": "array",
      "items": {
        "type": "object",
        "properties": {
          "id": {
            "type": "string",
            "minLength": 1
          },
          "status": {
            "type": "string",
            "enum": [
              "open",
              "resolved"
            ]
          },
          "title": {
            "type": "string",
            "minLength": 1
          },
          "severity": {
            "type": "string",
            "enum": [
              "high",
              "medium",
              "low"
            ]
          },
          "confidence": {
            "type": "number",
            "minimum": 0,
            "maximum": 1
          },
          "validated": {
            "type": "boolean"
          },
          "description": {
            "type": "string"
          },
          "evidence": {
            "type": "string"
          },
          "location": {
            "type": "object",
            "properties": {
              "path": {
                "type": "string",
                "minLength": 1
              },
              "startLine": {
                "type": "integer",
                "minimum": 1,
                "maximum": 9007199254740991
              },
              "endLine": {
                "type": "integer",
                "minimum": 1,
                "maximum": 9007199254740991
              }
            },
            "required": [
              "path"
            ],
            "additionalProperties": false
          },
          "rule": {
            "type": "string",
            "minLength": 1
          },
          "cwe": {
            "type": "string",
            "minLength": 1
          },
          "url": {
            "type": "string",
            "format": "uri"
          }
        },
        "required": [
          "id",
          "title",
          "severity",
          "confidence"
        ],
        "additionalProperties": false
      }
    }
  },
  "required": [
    "schema",
    "source",
    "deliveryId",
    "run",
    "repo",
    "findings"
  ],
  "additionalProperties": false
}
